{
  "partner_domain": "app.partner-n.io",
  "template_name": "PartnerNAccessGrantsTemplate_2026_07_08",
  "template_description": "S3 Access Grants onboarding with account-scoped boundary via condition",
  "boundary_name": "PartnerNAccessGrants_2026_07_08",
  "boundary_description": "Maximum permissions for access grants role using aws:ResourceAccount condition"
}
